{
  "$schema": "./job-skill-shelver-question-delivery-lock-v1.schema.json",
  "schema_version": "job-skill-shelver-question-delivery-lock-v1",
  "lock_id": "job-skill-shelver-delivery-lock-2026-07-22",
  "status": "LOCKED_FOR_PRODUCTION_NOT_RELEASE",
  "generated_at": "2026-07-22T14:50:00+08:00",
  "authority": {
    "authority_id": "job-skill-shelver-298-disposition-authority-v1",
    "authority_hash": "sha256:dfdfabe672470a43c8ce2db39f4b581c327847c27c6f7902ecc9caa583fe12bb",
    "semantic_root_hash": "sha256:f4eb1d4d64587e58044dee82a1609d77c93dd75bc4618a13f75f6f65fdefcee1"
  },
  "sources": [
    {
      "path": "doc/features/job-skill-shelver-298-disposition-authority-v1.json",
      "sha256": "sha256:dcb41700a19a1a9de6345b52f902519843fd1ee00976d10ed2fba985db4fa7e8"
    },
    {
      "path": "doc/assets/offline-toolkit-manifest-v1.json",
      "sha256": "sha256:4f7f869cebca1f1f2909fa8f2a7a3d3ee5598facd236a447517aa55a248df955"
    },
    {
      "path": "doc/assets/asset-manifest.json",
      "sha256": "sha256:cf2ff17fb4899073c0cd9369ee926737ac6fe578f7f4d9c0a96b4cfa669a2628"
    }
  ],
  "summary": {
    "locked_question_total": 181,
    "offline_setup_total": 100,
    "video_answer_total": 68,
    "image_requirement_total": 13,
    "offline_example_image_total": 4,
    "date_question_total": 20,
    "script_question_total": 13
  },
  "release_gate": {
    "releaseable": false,
    "reason": "298道题仅编译为DRAFT；24道Pilot独立门禁和270项资产均未完成，禁止激活题目、创建测评或写入运行数据库。"
  },
  "questions": [
    {
      "source_question_id": "M1_DG_031",
      "current_question_id": "M1_DG_031_V2",
      "current_question_version": 2,
      "module": "M1",
      "question_type": "DRAG",
      "disposition": "REVISED_RETURNED",
      "semantic_hash": "sha256:57c75284e415fd70fd3a499cba48466b73b1147284de41647a0464dae620ee33",
      "delivery": {
        "types": [
          "IMAGE_REQUIREMENT"
        ],
        "offline_setup_id": null,
        "asset_ids": [
          "asset_delivery_answer_image_m1_dg_031"
        ],
        "expected_answer": null,
        "answer_contract_hash": "sha256:39af9a12efc831277016399cc57b665c45d9ca411647af42a0018063992daa00"
      }
    },
    {
      "source_question_id": "M1_OB_048",
      "current_question_id": "M1_OB_048_V3",
      "current_question_version": 3,
      "module": "M1",
      "question_type": "OFFLINE_OPERATION",
      "disposition": "REPLACEMENT_REVIEW_PASSED_PENDING_ACTIVATION",
      "semantic_hash": "sha256:1e641508132b4f09ff926596382b26685857bc5832aff4c4ca9647cbe66981e5",
      "delivery": {
        "types": [
          "OFFLINE_SETUP"
        ],
        "offline_setup_id": "setup_m1_ob_048_v3",
        "asset_ids": [
          "asset_offline_tool_09"
        ],
        "expected_answer": null,
        "answer_contract_hash": "sha256:26a5f8b46f4d47e384589f21a3547f19c4e2fda783f82134144ceffca78dd21d"
      }
    },
    {
      "source_question_id": "M1_OP_033",
      "current_question_id": "M1_OP_033_V2",
      "current_question_version": 2,
      "module": "M1",
      "question_type": "OFFLINE_OPERATION",
      "disposition": "PILOT_PENDING_GATE",
      "semantic_hash": "sha256:f8e9388bf064b1f23cd9cf06718005c12dcd9f0e026c9bc2c5228ce38271b7e7",
      "delivery": {
        "types": [
          "OFFLINE_SETUP"
        ],
        "offline_setup_id": "setup_m1_op_033_v2",
        "asset_ids": [],
        "expected_answer": null,
        "answer_contract_hash": "sha256:cbdc87d7b5dac06cc5d30a9fe2939017b95b373e2954729bcc5fbb78141f2623"
      }
    },
    {
      "source_question_id": "M1_OP_034",
      "current_question_id": "M1_OP_034_V4",
      "current_question_version": 4,
      "module": "M1",
      "question_type": "OFFLINE_OPERATION",
      "disposition": "REVISED_RETURNED",
      "semantic_hash": "sha256:5909aab96e42a707819c2b63f29bd3b912fa5db51a0af099b720aba4ed2edc4a",
      "delivery": {
        "types": [
          "OFFLINE_SETUP"
        ],
        "offline_setup_id": "setup_m1_op_034_v4",
        "asset_ids": [
          "asset_offline_tool_05"
        ],
        "expected_answer": null,
        "answer_contract_hash": "sha256:b053d0a33706ad0d243007192d504672a6a6fcc0bbdf1ba1238558239afc3281"
      }
    },
    {
      "source_question_id": "M1_OP_035",
      "current_question_id": "M1_OP_035_V4",
      "current_question_version": 4,
      "module": "M1",
      "question_type": "OFFLINE_OPERATION",
      "disposition": "REVISED_RETURNED",
      "semantic_hash": "sha256:7f7c7b7adc913f7b465b7a11b40432833fa1ccaa9e71aabaed79b070915d14ab",
      "delivery": {
        "types": [
          "OFFLINE_SETUP"
        ],
        "offline_setup_id": "setup_m1_op_035_v4",
        "asset_ids": [],
        "expected_answer": null,
        "answer_contract_hash": "sha256:9cec4d1933a04dd8751c3f84a945c8fef0826a60c89adc3a156e516de415e018"
      }
    },
    {
      "source_question_id": "M1_OP_036",
      "current_question_id": "M1_OP_036_V4",
      "current_question_version": 4,
      "module": "M1",
      "question_type": "OFFLINE_OPERATION",
      "disposition": "REVISED_RETURNED",
      "semantic_hash": "sha256:bb950a546177634c3443bc1fda0ca2ed8bcbf505dd57f3bc97cda4d2c9c1210b",
      "delivery": {
        "types": [
          "OFFLINE_SETUP"
        ],
        "offline_setup_id": "setup_m1_op_036_v4",
        "asset_ids": [
          "asset_offline_tool_05"
        ],
        "expected_answer": null,
        "answer_contract_hash": "sha256:4a1b8edc5922a0ce1499581df799fe140f704056f6af8f08b5a174cc6ec42e20"
      }
    },
    {
      "source_question_id": "M1_OP_037",
      "current_question_id": "M1_OP_037_V5",
      "current_question_version": 5,
      "module": "M1",
      "question_type": "OFFLINE_OPERATION",
      "disposition": "REVISED_RETURNED",
      "semantic_hash": "sha256:4f5375fc90a5d2c9c35af89c9771652615c4a2e69a0bd9778b4a7735eb55a65b",
      "delivery": {
        "types": [
          "OFFLINE_SETUP"
        ],
        "offline_setup_id": "setup_m1_op_037_v5",
        "asset_ids": [
          "asset_offline_tool_05"
        ],
        "expected_answer": null,
        "answer_contract_hash": "sha256:0555a714dabcb6cd1a776de1e5e777ef3ae7398005644e5b79fc756bba7d0172"
      }
    },
    {
      "source_question_id": "M1_OP_038",
      "current_question_id": "M1_OP_038_V5",
      "current_question_version": 5,
      "module": "M1",
      "question_type": "OFFLINE_OPERATION",
      "disposition": "REVISED_RETURNED",
      "semantic_hash": "sha256:5d0154bf9b8874e0b223d3c0df8e3bde7809ad984074c507ade6966331fb242c",
      "delivery": {
        "types": [
          "OFFLINE_SETUP"
        ],
        "offline_setup_id": "setup_m1_op_038_v5",
        "asset_ids": [
          "asset_offline_tool_09",
          "asset_offline_tool_10"
        ],
        "expected_answer": null,
        "answer_contract_hash": "sha256:606fa21f5e83cd0587a16e6ef1f03473a04240ed64e1ab3bcdb5ad17fe168e43"
      }
    },
    {
      "source_question_id": "M1_OP_039",
      "current_question_id": "M1_OP_039_V4",
      "current_question_version": 4,
      "module": "M1",
      "question_type": "OFFLINE_OPERATION",
      "disposition": "REVISED_RETURNED",
      "semantic_hash": "sha256:cf6e579ec2905fac4dfbf48176ec0dc50ddd5df8f5fa4073bfcb24d54681e2bd",
      "delivery": {
        "types": [
          "OFFLINE_SETUP"
        ],
        "offline_setup_id": "setup_m1_op_039_v4",
        "asset_ids": [
          "asset_offline_tool_05"
        ],
        "expected_answer": null,
        "answer_contract_hash": "sha256:00d90a8caf4efe776aeb3756b972cf524b416e9b94af2c633e11c37f27420ab4"
      }
    },
    {
      "source_question_id": "M1_OP_040",
      "current_question_id": "M1_OP_040_V4",
      "current_question_version": 4,
      "module": "M1",
      "question_type": "OFFLINE_OPERATION",
      "disposition": "REVISED_RETURNED",
      "semantic_hash": "sha256:70fb682cc69307366c311d03c2f10d19414526d56467ec7936952932c8bb230c",
      "delivery": {
        "types": [
          "OFFLINE_SETUP"
        ],
        "offline_setup_id": "setup_m1_op_040_v4",
        "asset_ids": [],
        "expected_answer": null,
        "answer_contract_hash": "sha256:787e85ae4e2c6f17ba523fda185186a676c8aab0381fde2b8d176a85783b5359"
      }
    },
    {
      "source_question_id": "M1_OP_041",
      "current_question_id": "M1_OP_041_V4",
      "current_question_version": 4,
      "module": "M1",
      "question_type": "OFFLINE_OPERATION",
      "disposition": "REVISED_RETURNED",
      "semantic_hash": "sha256:cfb15eb0282b175050b71863eb5c7f3255318418e47c4226046004e810770f6d",
      "delivery": {
        "types": [
          "OFFLINE_SETUP"
        ],
        "offline_setup_id": "setup_m1_op_041_v4",
        "asset_ids": [],
        "expected_answer": null,
        "answer_contract_hash": "sha256:f9dc2bc414bee756fe9064279c0c5a63f94575a43035f72777d57a6f9bcb0152"
      }
    },
    {
      "source_question_id": "M1_OP_042",
      "current_question_id": "M1_OP_042_V4",
      "current_question_version": 4,
      "module": "M1",
      "question_type": "OFFLINE_OPERATION",
      "disposition": "REPLACEMENT_REVIEW_PASSED_PENDING_ACTIVATION",
      "semantic_hash": "sha256:89f1888d14191e356737bd8fcd58769e1a317bb9d2973ac745795b4c7efa5cfc",
      "delivery": {
        "types": [
          "OFFLINE_SETUP"
        ],
        "offline_setup_id": "setup_m1_op_042_v4",
        "asset_ids": [
          "asset_offline_tool_05"
        ],
        "expected_answer": null,
        "answer_contract_hash": "sha256:29db549e086ab9b6df9d95e0c5570237a11c1c745c41f1774c6172a8480d277e"
      }
    },
    {
      "source_question_id": "M1_OP_043",
      "current_question_id": "M1_OP_043_V4",
      "current_question_version": 4,
      "module": "M1",
      "question_type": "OFFLINE_OPERATION",
      "disposition": "REVISED_RETURNED",
      "semantic_hash": "sha256:4600a1a4554696e2226c0275fc2b89b40eb84115e704f2055aec77e9cceb2609",
      "delivery": {
        "types": [